{
	"$schema": "http://json-schema.org/draft-07/schema",
	"$id": "/resume.schema.json",
	"title": "Resume",
	"description": "Serves as a way to easily edit the resume on the portfolio without editing the HTML content",
	"type": "object",
	"properties": {
		"highlights": {
			"description": "A list of 3 highlights that are seen at the top of the resume page",
			"type": "array",
			"items": { "type": "object", "$ref": "#/$defs/highlightItem" },
			"uniqueItems": true,
			"minItems": 3,
			"maxItems": 3
		},
		"skills": {
			"description": "Represents the skills shown on the resume",
			"type": "array",
			"items": { "type": "object", "$ref": "#/$defs/skillCategory" },
			"minItems": 1,
			"uniqueItems": true
		},
		"education": {
			"description": "Represents the education on the resume",
			"type": "array",
			"items": { "type": "object", "$ref": "#/$defs/eduExperience" },
			"minItems": 1,
			"uniqueItems": true
		},
		"experience": {
			"description": "Represents the Job Experience shown on the resume",
			"type": "array",
			"items": { "type": "object", "$ref": "#/$defs/profExperience" },
			"minItems": 1,
			"uniqueItems": true
		}
	},
	"$defs": {
		"highlightItem": {
			"description": "Defines one of the three \"highlights\" on top of the resume page",
			"type": "object",
			"properties": {
				"icon": {
					"description": "The icon used for this highlight. See https://www.nerdfonts.com/cheat-sheet for a list of available symbols",
					"type": "string"
				},
				"stat": {
					"description": "The statistic used for the highlight",
					"type": "string"
				},
				"statDescription": {
					"description": "A description for the statistic in the highlight",
					"type": "string"
				},
				"required": ["icon", "stat", "statDescription"]
			}
		},
		"skillCategory": {
			"description": "Represents a category for skills",
			"type": "object",
			"properties": {
				"categoryName": {
					"description": "Name of the skill category",
					"type": "string"
				},
				"highSkill": {
					"description": "List of skills withing the category with advanced knowledge",
					"type": "array",
					"items": { "type": "string" },
					"minItems": 1,
					"uniqueItems": true
				},
				"medSkill": {
					"description": "List of skills withing the category with intermediate knowledge",
					"type": "array",
					"items": { "type": "string" },
					"minItems": 1,
					"uniqueItems": true
				},
				"lowSkill": {
					"description": "List of skills withing the category with beginner knowledge",
					"type": "array",
					"items": { "type": "string" },
					"minItems": 1,
					"uniqueItems": true
				}
			},
			"required": ["categoryName", "lowSkill"]
		},
		"eduExperience": {},
		"profExperience": {
			"description": "This is an entry for profesional experience (e.g. a job/internship)",
			"type": "object",
			"properties": {}
		}
	}
}
